{
  "schema_version": 4,
  "scenario_id": "scenario.relevance_fixture",
  "scenario_hash": "sha256:d19e418fc4f641f34ab6fca50229b5c74f0e8e94dd2548486be2c1c6c3696702",
  "constants_hash": "sha256:55822d7070dab52fc78b469d40ed14bf1eb2012535a8ae6962d59d42bb4f573a",
  "relevance_policy_hash": "sha256:04b7149ad2e6d8fa9ab3da549e6cddb20c42b28fd62693ce507ab8424b0f0e56",
  "run_budget": {
    "declared_runs": 14,
    "executed_runs": 14,
    "declared_transitions": 20711,
    "executed_transitions": 20711
  },
  "greedy_oracle": {
    "milestone_id": "milestone.cash_target",
    "greedy_ms": 11976,
    "beam_ms": 11662,
    "gap_ppm": 26925,
    "maximum_ppm": 25000,
    "passed": false
  },
  "items": [
    {
      "purchasable_id": "generator.alpha",
      "availability_window": {
        "from_gate": "gate.t0_to_t1",
        "to_gate": "gate.t1_to_t2"
      },
      "epsilon_ms": 1,
      "trap_exempt": false,
      "justification_key": null,
      "baseline_purchase_count": 0,
      "excluded_persona_ids": [
        "reference.greedy"
      ],
      "instrument_affected": true,
      "individual_deltas": [
        {
          "milestone_id": "milestone.cash_target",
          "status": "both_unreached",
          "baseline_ms": null,
          "ablated_ms": null,
          "delta_ms": null
        }
      ],
      "action_removal_deltas": [
        {
          "milestone_id": "milestone.cash_target",
          "status": "both_unreached",
          "baseline_ms": null,
          "ablated_ms": null,
          "delta_ms": null
        }
      ],
      "support": "group_supported",
      "supporting_group_id": "group.category_fixture",
      "nearest_passing_epsilon_ms": 0,
      "relevance_passed": true,
      "trap_passed": false
    },
    {
      "purchasable_id": "generator.beta",
      "availability_window": {
        "from_gate": "gate.t0_to_t1",
        "to_gate": "gate.t1_to_t2"
      },
      "epsilon_ms": 1,
      "trap_exempt": false,
      "justification_key": null,
      "baseline_purchase_count": 11,
      "excluded_persona_ids": [],
      "instrument_affected": false,
      "individual_deltas": [
        {
          "milestone_id": "milestone.cash_target",
          "status": "ablated_unreached",
          "baseline_ms": 11976,
          "ablated_ms": null,
          "delta_ms": 168024
        }
      ],
      "action_removal_deltas": [
        {
          "milestone_id": "milestone.cash_target",
          "status": "ablated_unreached",
          "baseline_ms": 11976,
          "ablated_ms": null,
          "delta_ms": 168024
        }
      ],
      "support": "individual",
      "supporting_group_id": null,
      "nearest_passing_epsilon_ms": 0,
      "relevance_passed": true,
      "trap_passed": true
    },
    {
      "purchasable_id": "upgrade.alpha",
      "availability_window": {
        "from_gate": "gate.t0_to_t1",
        "to_gate": "gate.t1_to_t2"
      },
      "epsilon_ms": 1,
      "trap_exempt": true,
      "justification_key": "relevance.intentional_trap",
      "baseline_purchase_count": 0,
      "excluded_persona_ids": [
        "reference.greedy"
      ],
      "instrument_affected": false,
      "individual_deltas": [
        {
          "milestone_id": "milestone.cash_target",
          "status": "both_unreached",
          "baseline_ms": null,
          "ablated_ms": null,
          "delta_ms": null
        }
      ],
      "action_removal_deltas": [
        {
          "milestone_id": "milestone.cash_target",
          "status": "both_unreached",
          "baseline_ms": null,
          "ablated_ms": null,
          "delta_ms": null
        }
      ],
      "support": "failed",
      "supporting_group_id": null,
      "nearest_passing_epsilon_ms": 1,
      "relevance_passed": false,
      "trap_passed": true
    },
    {
      "purchasable_id": "upgrade.dead",
      "availability_window": {
        "from_gate": "gate.t0_to_t1",
        "to_gate": "gate.t1_to_t2"
      },
      "epsilon_ms": 1,
      "trap_exempt": false,
      "justification_key": null,
      "baseline_purchase_count": 0,
      "excluded_persona_ids": [
        "reference.greedy"
      ],
      "instrument_affected": false,
      "individual_deltas": [
        {
          "milestone_id": "milestone.cash_target",
          "status": "both_unreached",
          "baseline_ms": null,
          "ablated_ms": null,
          "delta_ms": null
        }
      ],
      "action_removal_deltas": [
        {
          "milestone_id": "milestone.cash_target",
          "status": "both_unreached",
          "baseline_ms": null,
          "ablated_ms": null,
          "delta_ms": null
        }
      ],
      "support": "failed",
      "supporting_group_id": null,
      "nearest_passing_epsilon_ms": 1,
      "relevance_passed": false,
      "trap_passed": false
    }
  ],
  "groups": [
    {
      "group_id": "group.category_fixture",
      "axis": "category",
      "excluded_persona_ids": [],
      "deltas": [
        {
          "milestone_id": "milestone.cash_target",
          "status": "ablated_unreached",
          "baseline_ms": 11976,
          "ablated_ms": null,
          "delta_ms": 168024
        }
      ],
      "passed": true
    },
    {
      "group_id": "group.substitutes",
      "axis": "declared",
      "excluded_persona_ids": [
        "reference.greedy"
      ],
      "deltas": [
        {
          "milestone_id": "milestone.cash_target",
          "status": "both_unreached",
          "baseline_ms": null,
          "ablated_ms": null,
          "delta_ms": null
        }
      ],
      "passed": false
    },
    {
      "group_id": "group.tier_0",
      "axis": "tier",
      "excluded_persona_ids": [
        "reference.greedy"
      ],
      "deltas": [
        {
          "milestone_id": "milestone.cash_target",
          "status": "both_unreached",
          "baseline_ms": null,
          "ablated_ms": null,
          "delta_ms": null
        }
      ],
      "passed": false
    },
    {
      "group_id": "group.tier_1",
      "axis": "tier",
      "excluded_persona_ids": [],
      "deltas": [
        {
          "milestone_id": "milestone.cash_target",
          "status": "ablated_unreached",
          "baseline_ms": 11976,
          "ablated_ms": null,
          "delta_ms": 168024
        }
      ],
      "passed": true
    }
  ],
  "tier_contributions": [
    {
      "group_id": "group.tier_0",
      "deltas": [
        {
          "milestone_id": "milestone.cash_target",
          "status": "both_unreached",
          "baseline_ms": null,
          "ablated_ms": null,
          "delta_ms": null
        }
      ]
    },
    {
      "group_id": "group.tier_1",
      "deltas": [
        {
          "milestone_id": "milestone.cash_target",
          "status": "ablated_unreached",
          "baseline_ms": 11976,
          "ablated_ms": null,
          "delta_ms": 168024
        }
      ]
    }
  ],
  "role_activations": [
    {
      "generator_id": "generator.beta",
      "kind": "provision",
      "target_id": "generator.alpha",
      "count": 5
    }
  ],
  "instrument_excluded_ids": [
    "generator.alpha"
  ],
  "failures": [
    "greedy_oracle:gap",
    "instrument_affected:trap_floor:generator.alpha",
    "relevance_floor:upgrade.alpha",
    "relevance_floor:upgrade.dead",
    "role_floor:generator.alpha",
    "trap_floor:upgrade.dead"
  ]
}
